{
  "manifest_version": 1,
  "contract_id": "invoice-manager.foundation",
  "owner_mission": "p0",
  "mission": "p0-contract-spine-01KXYY0J",
  "version": "0.1.0-draft.1",
  "state": "Draft",
  "baseline_commit": "a71448bbec991a6bf0be805129d704beab06d486",
  "content_digest": "pending",
  "dependencies": [],
  "inputs": [],
  "outputs": [
    { "path": "contracts/api/v1/base.openapi.yaml", "kind": "api_fragment", "digest": "pending" },
    { "path": "contracts/common/v1/schema.json", "kind": "common_schema", "digest": "pending" },
    { "path": "contracts/conformance/p0-p4-inputs.json", "kind": "other", "digest": "pending" },
    { "path": "contracts/events/v1/catalog.schema.json", "kind": "event_catalog", "digest": "pending" },
    { "path": "contracts/events/v1/envelope.schema.json", "kind": "event_envelope", "digest": "pending" },
    { "path": "contracts/manifests/v1/schema.json", "kind": "contract_manifest", "digest": "pending" },
    { "path": "contracts/migrations/v1/manifest.schema.json", "kind": "migration_schema", "digest": "pending" },
    { "path": "contracts/modules/p0/module.json", "kind": "module_manifest", "digest": "pending" },
    { "path": "contracts/modules/v1/schema.json", "kind": "module_manifest", "digest": "pending" }
  ],
  "owned_paths": ["contracts/api/**", "contracts/events/**", "contracts/manifests/**", "contracts/migrations/**", "contracts/modules/**", "contracts/conformance/**", "tools/contracts/**"],
  "shared_touchpoints": [
    { "path": "package.json", "steward": "program-integration-steward", "reason": "Root contract command wiring" }
  ],
  "migration_strategy": { "mode": "owner_scoped_forward_only", "root": "services/api/migrations/p0" },
  "integration_fixtures": [
    { "path": "contracts/fixtures/p0/v1/invalid/lifecycle-frozen-pending-digest.json", "expectation": "invalid", "digest": "pending" },
    { "path": "contracts/fixtures/p0/v1/invalid/module-duplicate-mount.json", "expectation": "invalid", "digest": "pending" },
    { "path": "contracts/fixtures/p0/v1/valid/lifecycle-draft.json", "expectation": "valid", "digest": "pending" },
    { "path": "contracts/fixtures/p0/v1/valid/module-pair.json", "expectation": "valid", "digest": "pending" }
  ]
}
