{"baseline_commit":"a71448bbec991a6bf0be805129d704beab06d486","content_digest":"sha256:6ff2126ce659465dfdded2e33aab6fa61c1ded90bf3ef22f2d6daceb30864a15","contract_id":"invoice-manager.foundation","dependencies":[],"inputs":[],"integration_fixtures":[{"digest":"sha256:50b159355711c912c76ad3781b65e866874e36ddd33c85387b8fff886bb88457","expectation":"invalid","path":"contracts/fixtures/p0/v1/invalid/lifecycle-frozen-pending-digest.json"},{"digest":"sha256:25f87ce70414ac5b46a5f5c2c8e65d384964f52b0b1b510ca77e990b78951919","expectation":"invalid","path":"contracts/fixtures/p0/v1/invalid/module-duplicate-mount.json"},{"digest":"sha256:77a295e5ab9e05b9414b0e4a517d2a6b477fd1f23a35d67850dc9d0376d93551","expectation":"valid","path":"contracts/fixtures/p0/v1/valid/lifecycle-draft.json"},{"digest":"sha256:2470b46575765fe2d9f5054d0c735586ab1e9f9ef35c6838f1ce6685c9f2c359","expectation":"valid","path":"contracts/fixtures/p0/v1/valid/module-pair.json"}],"manifest_version":1,"migration_strategy":{"mode":"owner_scoped_forward_only","root":"services/api/migrations/p0"},"mission":"p0-contract-spine-01KXYY0J","outputs":[{"digest":"sha256:2f1c140393fd89e109c975d1521a77d0df4ac82bd3f03e3aaa86058edb456dd4","kind":"api_fragment","path":"contracts/api/v1/base.openapi.yaml"},{"digest":"sha256:720ecf6c8b7918073e378e045e614c157967bc3ba8ae6c4b7aeef42ac8a6c93c","kind":"common_schema","path":"contracts/common/v1/schema.json"},{"digest":"sha256:e17a1e2b1f4ca3b2a9ddfa6e51df1a27faf794c5312df65925f216cc3eb0256f","kind":"other","path":"contracts/conformance/p0-p4-inputs.json"},{"digest":"sha256:5751baa4dced645f0ed4f61c4ccff278a6c5301b36645d13c93bcf6a83ac5254","kind":"event_catalog","path":"contracts/events/v1/catalog.schema.json"},{"digest":"sha256:d6f94a87c50b2c41644c9da6a4a9e787b8c0ae81b5b8a241b41954f4edf34380","kind":"event_envelope","path":"contracts/events/v1/envelope.schema.json"},{"digest":"sha256:89bc8a18a88821a248c17a13bfae71b6e6d2b95a31cd350eddaaba4dd16e3c38","kind":"contract_manifest","path":"contracts/manifests/v1/schema.json"},{"digest":"sha256:6d8d03775641c3eab0e8392d3841f12b9509c47377c30dcf6fcedf32e2873d2f","kind":"migration_schema","path":"contracts/migrations/v1/manifest.schema.json"},{"digest":"sha256:c6853ee869fbbdf39b934c3d486841edbc78e19f0411a0d6fe66a10c2133a38a","kind":"module_manifest","path":"contracts/modules/p0/module.json"},{"digest":"sha256:8dc2020d9597b5e5fd0f0a2e82a55c783a94d3da9527655f4bd5548e6346471f","kind":"module_manifest","path":"contracts/modules/v1/schema.json"}],"owned_paths":["contracts/api/**","contracts/events/**","contracts/manifests/**","contracts/migrations/**","contracts/modules/**","contracts/conformance/**","tools/contracts/**"],"owner_mission":"p0","shared_touchpoints":[{"path":"package.json","reason":"Root contract command wiring","steward":"program-integration-steward"}],"state":"Implemented","version":"0.1.0-draft.1"}
